title,text,created_utc
Meta Quest gets 'Travel Mode' in beta for use on airplanes,,1715634065.0
"Google Earth gets a redesigned Android app with Projects support, removes Voyager",,1695880852.0
Google is finally saying goodbye to Google Play Movies & TV,,1702347054.0
The Oura Ring makes its way to Target's physical and online store,,1713895897.0
Google suspends Gemini AI chatbot's ability to generate pictures of people,,1708632365.0
"Samsung contract requires repair shops to share customer data, restricts repairs",,1716597401.0
EU opens antitrust probe into Microsoft over Teams bundling,,1690496354.0
The End of ‘iPhone’,,1716838611.0
Microsoft makes its AI-powered reading tutor free | TechCrunch,,1705632962.0
This startup is bringing a 'voice frequency absorber' to CES 2024 | TechCrunch,,1704409895.0
How Microsoft’s cybercrime unit has evolved to combat increased threats,,1702835808.0
"Known Android flaws are just as bad as zero-days, finds Google",,1690994115.0
Fitbit is adding generative AI features that look genuinely useful,,1696799843.0
"Meta Plans to Charge $14 a Month for Ad-Free Instagram or Facebook | European users would have option to pay fee or agree to personalized ads, according to company’s pitch to regulators",,1696348285.0
Zoom addresses concerns over its AI training on user data; employees asked to return to office,,1691497725.0
"Legendary Torrent Site RARBG Shuts Down Due to War, COVID, Inflation",,1685576114.0
Will AI kill cybersecurity jobs?,,1691671603.0
Typo blamed for Microsoft Azure DevOps outage in Brazil,,1685975553.0
